<?xml version="1.0" encoding="UTF-8"?>
<xsd:schema xmlns:xsd = "http://www.w3.org/2001/XMLSchema">
<xsd:element name="filmoteca"/>
<xsd:element name="peli" type="pelicula"/>
<xsd:complexType name="pelicula">
    <xsd:sequence>
        <xsd:element name="titol" type="xsd:string"/>
        <xsd:element name="director" type="xsd:string"/>
    </xsd:sequence>
</xsd:complexType>
</xsd:schema>